{
  "schema_version": 1,
  "operation_id": "11111111-1111-4111-8111-111111111111",
  "idempotency_key": "22222222-2222-4222-8222-222222222222",
  "attempt_id": "33333333-3333-4333-8333-333333333333",
  "tenant_id": "44444444-4444-4444-8444-444444444444",
  "request_kind": "provider.invoke",
  "started_at": "2026-08-11T00:00:00Z",
  "deadline_at": "2026-08-11T00:02:00Z",
  "budget": {
    "schema_version": 1,
    "timeout_ms": 120000,
    "max_attempts": 2,
    "max_input_bytes": 1048576,
    "max_output_bytes": 1048576,
    "max_cost_minor": 100
  }
}
